<?xml version="1.0" encoding="UTF-8"?>
<!--
/**
 * Plumrocket Inc.
 *
 * NOTICE OF LICENSE
 *
 * This source file is subject to the End-user License Agreement
 * that is available through the world-wide-web at this URL:
 * http://wiki.plumrocket.net/wiki/EULA
 * If you are unable to obtain it through the world-wide-web, please
 * send an email to support@plumrocket.com so we can send you a copy immediately.
 *
 * @package     Plumrocket_AmpEmail
 * @copyright   Copyright (c) 2019 Plumrocket Inc. (http://www.plumrocket.com)
 * @license     http://wiki.plumrocket.net/wiki/EULA  End-user License Agreement
 */
 -->
<xs:schema xmlns:xs="http://www.w3.org/2001/XMLSchema">
    <xs:complexType name="emailTemplateType">
        <xs:attribute name="id" type="xs:string" use="required"/>
        <xs:attribute name="label" type="xs:string" use="required"/>
        <xs:attribute name="file" type="xs:string" use="required"/>
        <xs:attribute name="module" type="xs:string" use="required"/>
        <xs:attribute name="area" type="areaType" use="required"/>
    </xs:complexType>

    <xs:simpleType name="areaType">
        <xs:restriction base="xs:string">
            <xs:enumeration value="frontend"/>
            <xs:enumeration value="adminhtml"/>
        </xs:restriction>
    </xs:simpleType>

    <xs:element name="config">
        <xs:complexType>
            <xs:sequence>
                <xs:element name="template" type="emailTemplateType" minOccurs="1" maxOccurs="unbounded"/>
            </xs:sequence>
        </xs:complexType>
    </xs:element>
</xs:schema>
